{
  "version": "1.0",
  "run_id": "example-run-1",
  "repo_root": "/abs/path/to/repo",
  "task": {
    "id": "task-123",
    "type": "integration",
    "skill": "noise-reduction-integration",
    "provider": "acme_denoise",
    "service": "assistant-api"
  },
  "task_plan": {
    "allowed_paths": [
      "api/assistant-api/internal/denoiser/internal/acme_denoise/",
      "api/assistant-api/internal/denoiser/denoiser.go",
      "ui/src/providers/acme_denoise/noise.json"
    ],
    "out_of_scope_paths": [
      "api/assistant-api/internal/vad/internal/",
      "api/assistant-api/internal/end_of_speech/internal/"
    ],
    "required_tests": [
      "factory-selection",
      "fallback-error-path",
      "packet-contract"
    ]
  },
  "implementation": {
    "changed_files": [
      "api/assistant-api/internal/denoiser/denoiser.go",
      "api/assistant-api/internal/denoiser/internal/acme_denoise/denoiser.go",
      "api/assistant-api/internal/denoiser/internal/acme_denoise/denoiser_test.go",
      "ui/src/providers/acme_denoise/noise.json"
    ],
    "test_files_added": [
      "api/assistant-api/internal/denoiser/internal/acme_denoise/denoiser_test.go"
    ],
    "tests_covered": [
      "factory-selection",
      "fallback-error-path",
      "packet-contract"
    ],
    "summary": "Provider wired and tests added."
  },
  "meta": {
    "triggered_by": "implementer",
    "timestamp": "2026-03-23T12:05:00Z"
  }
}
