{
  "version": "1.0",
  "run_id": "example-run-1",
  "repo_root": "/abs/path/to/repo",
  "task": {
    "id": "task-123",
    "type": "integration",
    "skill": "noise-reduction-integration",
    "provider": "acme_denoise",
    "service": "assistant-api"
  },
  "task_plan": {
    "required_tests": [
      "factory-selection",
      "fallback-error-path",
      "packet-contract"
    ]
  },
  "verification": {
    "commands": [
      {
        "cmd": "go test ./api/assistant-api/internal/denoiser/...",
        "exit_code": 0
      },
      {
        "cmd": "./.codex/skills/noise-reduction-integration/scripts/validate.sh --check-diff --provider acme_denoise",
        "exit_code": 0
      }
    ],
    "coverage": {
      "unit_tests_present": true,
      "required_categories_passed": [
        "factory-selection",
        "fallback-error-path",
        "packet-contract"
      ]
    }
  },
  "meta": {
    "triggered_by": "verifier",
    "timestamp": "2026-03-23T12:10:00Z"
  }
}
