{
  "version": "1.0",
  "run_id": "example-run-1",
  "repo_root": "/abs/path/to/repo",
  "task": {
    "id": "task-123",
    "type": "integration",
    "skill": "noise-reduction-integration",
    "provider": "acme_denoise",
    "service": "assistant-api"
  },
  "task_plan": {
    "allowed_paths": [
      "api/assistant-api/internal/denoiser/internal/acme_denoise/",
      "api/assistant-api/internal/denoiser/denoiser.go",
      "ui/src/providers/acme_denoise/noise.json"
    ],
    "out_of_scope_paths": [
      "api/assistant-api/internal/vad/internal/",
      "api/assistant-api/internal/end_of_speech/internal/"
    ],
    "required_tests": [
      "factory-selection",
      "fallback-error-path",
      "packet-contract"
    ],
    "required_commands": [
      "go test ./api/assistant-api/internal/denoiser/...",
      "./.codex/skills/noise-reduction-integration/scripts/validate.sh --check-diff --provider acme_denoise"
    ]
  },
  "meta": {
    "triggered_by": "planner",
    "timestamp": "2026-03-23T12:00:00Z"
  }
}
